url,title,date
https://www.youtube.com/watch?v=qu2m7ePTsqY,We need a moratorium on AI data centers NOW. Here’s why.,2026-03-11
https://www.youtube.com/watch?v=K3qS345gAWI,The threats from AI are real | Sen. Bernie Sanders,2025-12-03
https://www.youtube.com/watch?v=PaHpaGexjVY,The AI power grab. Where we go from here:,2026-03-27
https://www.youtube.com/watch?v=kpBtl-yBFeE,LIVE: Introducing the AI Data Center Moratorium Act,2026-03-25
https://www.youtube.com/watch?v=bpP_ZoIqMyI,LIVE: AI is going to transform the world,2025-12-08
https://www.youtube.com/watch?v=edTTeY1Zx-0,LIVE with the Godfather of AI,2025-11-19
